{
  "architectureOverview": {
    "architecturalStyle": "microservices",
    "designPrinciples": [
      "API-first design for maximum flexibility",
      "Event-driven architecture for real-time responsiveness",
      "Cloud-native design for scalability and cost efficiency",
      "Security by design with zero-trust principles",
      "Observability-first for operational excellence",
      "Domain-driven design for business alignment"
    ],
    "qualityAttributes": [
      "performance",
      "scalability", 
      "reliability",
      "security",
      "maintainability",
      "usability"
    ],
    "constraints": [
      "Bootstrap budget requiring cost-efficient solutions",
      "6-month MVP timeline",
      "Small team of 8 engineers",
      "GDPR and CCPA compliance requirements",
      "OpenAI API rate limits and costs",
      "Social media platform API restrictions"
    ],
    "assumptions": [
      "User base will grow 10x within 18 months",
      "AI generation costs will decrease over time",
      "Team will scale to 20+ engineers by year 2",
      "Multi-region deployment needed by month 12",
      "Real-time features are critical for user engagement"
    ]
  },
  "systemContext": {
    "systemBoundary": "CampaignAI platform including web frontend, mobile-responsive interface, backend services, AI generation, and third-party integrations. Excludes social media platforms, email providers, and payment processors.",
    "users": [
      {
        "type": "Small Business Owners",
        "description": "Primary users creating marketing campaigns without expertise",
        "interactionMethods": ["web_browser", "mobile_browser"]
      },
      {
        "type": "Marketing Managers", 
        "description": "Professional marketers managing multiple campaigns",
        "interactionMethods": ["web_browser", "api_integrations"]
      },
      {
        "type": "Agency Directors",
        "description": "Managing campaigns for multiple clients",
        "interactionMethods": ["web_browser", "bulk_operations", "reporting_apis"]
      },
      {
        "type": "System Administrators",
        "description": "Platform operations and maintenance",
        "interactionMethods": ["admin_dashboard", "cli_tools", "monitoring_systems"]
      }
    ],
    "externalSystems": [
      {
        "name": "OpenAI API",
        "type": "third_party_service",
        "purpose": "AI content generation and brand voice analysis",
        "interface": "REST API with rate limiting",
        "reliability": "high",
        "dataFlow": "bidirectional"
      },
      {
        "name": "Facebook Marketing API",
        "type": "third_party_service", 
        "purpose": "Campaign publishing and performance data",
        "interface": "Graph API with OAuth 2.0",
        "reliability": "medium",
        "dataFlow": "bidirectional"
      },
      {
        "name": "Stripe Payment API",
        "type": "third_party_service",
        "purpose": "Subscription billing and payment processing",
        "interface": "REST API with webhooks",
        "reliability": "high",
        "dataFlow": "bidirectional"
      },
      {
        "name": "SendGrid Email API",
        "type": "third_party_service",
        "purpose": "Transactional emails and campaign delivery",
        "interface": "REST API",
        "reliability": "high", 
        "dataFlow": "outbound"
      },
      {
        "name": "AWS S3",
        "type": "file_system",
        "purpose": "Media storage for campaign assets",
        "interface": "S3 API",
        "reliability": "high",
        "dataFlow": "bidirectional"
      }
    ]
  },
  "functionalArchitecture": {
    "applicationLayer": {
      "frontend": {
        "framework": "React 18 with Next.js 14",
        "language": "TypeScript",
        "stateManagement": "Zustand with React Query for server state",
        "styling": "Tailwind CSS with Headless UI components",
        "buildTool": "Vite with TypeScript and ESLint",
        "testingFramework": "Vitest + React Testing Library + Playwright",
        "components": [
          {
            "name": "Campaign Creation Wizard",
            "purpose": "Multi-step campaign setup with real-time validation",
            "technology": "React Hook Form with Zod validation",
            "dependencies": ["AI Generation Service", "Brand Voice API"]
          },
          {
            "name": "Real-time Analytics Dashboard",
            "purpose": "Live campaign performance monitoring",
            "technology": "Chart.js with WebSocket connections",
            "dependencies": ["Analytics Service", "WebSocket Gateway"]
          },
          {
            "name": "Brand Voice Configuration",
            "purpose": "AI training interface for brand consistency",
            "technology": "React Dropzone with PDF parsing",
            "dependencies": ["Document Processing Service", "Brand Voice AI"]
          }
        ]
      },
      "backend": {
        "framework": "Node.js with Fastify",
        "language": "TypeScript",
        "runtime": "Node.js 20 LTS",
        "apiStyle": "REST",
        "authentication": "JWT with refresh tokens",
        "authorization": "RBAC with permission-based access control",
        "services": [
          {
            "name": "Campaign Service",
            "purpose": "Campaign CRUD operations and lifecycle management",
            "technology": "Fastify with Prisma ORM",
            "endpoints": ["/campaigns", "/campaigns/:id", "/campaigns/:id/launch"],
            "dependencies": ["PostgreSQL", "Redis", "Event Bus"]
          },
          {
            "name": "AI Generation Service",
            "purpose": "Content generation using OpenAI with brand voice",
            "technology": "Python FastAPI with LangChain",
            "endpoints": ["/generate/content", "/analyze/brand-voice"],
            "dependencies": ["OpenAI API", "Vector Database", "Brand Voice Store"]
          },
          {
            "name": "Analytics Service",
            "purpose": "Campaign performance aggregation and reporting",
            "technology": "Node.js with ClickHouse integration",
            "endpoints": ["/analytics/:campaignId", "/analytics/aggregate"],
            "dependencies": ["ClickHouse", "Social Media APIs", "Event Streaming"]
          },
          {
            "name": "Integration Service", 
            "purpose": "Third-party platform connections and data sync",
            "technology": "Node.js with Bull Queue for job processing",
            "endpoints": ["/integrations", "/integrations/:platform/sync"],
            "dependencies": ["Redis Queue", "External APIs", "OAuth Store"]
          },
          {
            "name": "Notification Service",
            "purpose": "Real-time notifications and email delivery",
            "technology": "Node.js with Socket.io and SendGrid",
            "endpoints": ["/notifications", "/notifications/subscribe"],
            "dependencies": ["WebSocket Gateway", "Email Service", "Push Notification"]
          }
        ]
      }
    },
    "dataLayer": {
      "primaryDatabase": {
        "type": "relational",
        "technology": "PostgreSQL 15",
        "version": "15.4",
        "purpose": "Transactional data including users, campaigns, and configurations",
        "schema": "Prisma migrations with strict typing"
      },
      "additionalDatabases": [
        {
          "type": "key_value",
          "technology": "Redis 7",
          "version": "7.2",
          "purpose": "Session storage, caching, and job queues",
          "schema": "Schema-less with structured keys"
        },
        {
          "type": "document",
          "technology": "MongoDB Atlas",
          "version": "7.0",
          "purpose": "Campaign content, analytics events, and AI training data",
          "schema": "Mongoose ODM with validation schemas"
        },
        {
          "type": "time_series",
          "technology": "ClickHouse",
          "version": "23.8",
          "purpose": "Analytics data and performance metrics",
          "schema": "Columnar tables optimized for aggregations"
        },
        {
          "type": "search",
          "technology": "Pinecone Vector Database",
          "version": "latest",
          "purpose": "Brand voice embeddings and content similarity search",
          "schema": "Vector embeddings with metadata"
        }
      ],
      "caching": {
        "technology": "Redis with Redis Insight",
        "strategy": "cache_aside",
        "layers": ["Application cache", "Database query cache", "CDN edge cache"],
        "ttl": "User sessions: 8h, API responses: 5m, Static assets: 24h"
      },
      "dataProcessing": {
        "etl": "Apache Airflow for data pipeline orchestration",
        "streaming": "Apache Kafka for real-time event processing",
        "batchProcessing": "Node.js cron jobs with Bull Queue",
        "dataWarehouse": "ClickHouse with materialized views"
      }
    },
    "integrationLayer": {
      "messagingPattern": "hybrid",
      "messageQueue": "Redis Bull Queue for job processing",
      "eventStreaming": "Apache Kafka for real-time events",
      "apiGateway": "AWS API Gateway with custom authorizers",
      "serviceDiscovery": "Kubernetes service discovery with Consul",
      "circuitBreaker": "Hystrix pattern implementation in Node.js"
    }
  },
  "nonFunctionalArchitecture": {
    "performance": {
      "loadBalancing": {
        "technology": "AWS Application Load Balancer",
        "algorithm": "least_connections",
        "healthChecks": "HTTP health endpoints with 30s intervals"
      },
      "caching": {
        "cdn": "CloudFlare with global edge locations",
        "applicationCache": "Redis with intelligent cache warming",
        "databaseCache": "PostgreSQL query plan cache + connection pooling",
        "strategy": "Multi-layer caching with cache invalidation events"
      },
      "optimization": {
        "frontend": [